Rank,TV Series Title,Year Started,Year Ended,Duration,Genres,Rating,Votes,Description,Actors
85,Fargo,2014,2023,53,"['Crime', ' Drama', ' Thriller']",8.9,"385,700","Various chronicles of deception, intrigue and murder in and around frozen Minnesota. Yet all of these tales mysteriously lead back one way or another to Fargo, North Dakota.","['Billy Bob Thornton', ' Martin Freeman', ' Allison Tolman', ' Colin Hanks']"
86,Lucifer,2016,2021,42,"['Crime', ' Drama', ' Fantasy']",8.1,"339,017",Lucifer Morningstar has decided he's had enough of being the dutiful servant in Hell and decides to spend some time on Earth to better understand humanity. He settles in Los Angeles - the City of Angels.,"['Tom Ellis', ' Lauren German', ' Kevin Alejandro', ' D.B. Woodside']"
87,Smallville,2001,2011,60,"['Action', ' Adventure', ' Drama']",7.5,"133,307","A young Clark Kent struggles to find his place in the world as he learns to harness his alien powers for good and deals with the typical troubles of teenage life in Smallville, Kansas.","['Tom Welling', ' Michael Rosenbaum', ' Allison Mack', ' Kristin Kreuk']"
88,Sons of Anarchy,2008,2014,45,"['Crime', ' Drama', ' Thriller']",8.6,"309,268",A biker struggles to balance being a father and being involved in an outlaw motorcycle club.,"['Charlie Hunnam', ' Katey Sagal', ' Mark Boone Junior', ' Kim Coates']"
89,The Great,2020,Present,45,"['Biography', ' Comedy', ' Drama']",8.2,"49,367","A royal woman living in rural Russia during the 18th century is forced to choose between her own personal happiness and the future of Russia, when she marries an Emperor.","['Elle Fanning', ' Phoebe Fox', ' Gwilym Lee', ' Adam Godley']"
90,Invasion,2021,Present,60,"['Drama', ' Fantasy', ' Sci-Fi']",6.1,"32,193",Earth is visited by an alien species that threatens humanity's existence. Events unfold in real time through the eyes of five ordinary people across the globe as they struggle to make sense of the chaos unraveling around them.,"['Golshifteh Farahani', ' Shamier Anderson', ' Shioli Kutsuna', ' Billy Barratt']"
91,Castle,2009,2016,43,"['Comedy', ' Crime', ' Drama']",8.1,"168,240","After a serial killer imitates the plots of his novels, successful mystery novelist Richard ""Rick"" Castle receives permission from the Mayor of New York City to tag along with an NYPD homicide investigation team for research purposes.","['Nathan Fillion', ' Stana Katic', ' Susan Sullivan', ' Jon Huertas']"
92,9-1-1,2018,Present,43,"['Action', ' Drama', ' Thriller']",7.9,"40,305","Explores the high-pressure experiences of the first responders who are thrust into the most frightening, shocking, and heart-stopping situations.","['Angela Bassett', ' Peter Krause', ' Oliver Stark', ' Aisha Hinds']"
93,Blue Bloods,2010,Present,43,"['Crime', ' Drama', ' Mystery']",7.7,"44,014",Revolves around a family of New York cops.,"['Donnie Wahlberg', ' Bridget Moynahan', ' Will Estes', ' Len Cariou']"
94,Death in Paradise,2011,Present,60,"['Comedy', ' Crime', ' Drama']",7.8,"24,633",A Detective Inspector is transferred from London to the Caribbean island of Saint-Marie to investigate and solve complex murders.,"['Elizabeth Bourgine', ' Don Warrington', ' Danny John-Jules', ' Tobi Bakare']"
95,"Murder, She Wrote",1984,1996,50,"['Crime', ' Drama', ' Mystery']",7.2,"26,895","Professional writer and amateur sleuth Jessica Fletcher uses her intellect, charm, and persistence to get to the bottom of every crime she encounters.","['Angela Lansbury', ' William Windom', ' Ron Masak', ' Louis Herthum']"
96,The Vampire Diaries,2009,2017,43,"['Drama', ' Fantasy', ' Horror']",7.7,"333,727","The lives, loves, dangers and disasters in the town, Mystic Falls, Virginia. Creatures of unspeakable horror lurk beneath this town as a teenage girl is suddenly torn between two vampire brothers.","['Nina Dobrev', ' Paul Wesley', ' Ian Somerhalder', ' Kat Graham']"
97,The Last Kingdom,2015,2022,60,"['Action', ' Drama', ' History']",8.5,"155,838","As Alfred the Great defends his kingdom from Norse invaders, Uhtred--born a Saxon but raised by Vikings--seeks to claim his ancestral birthright.","['Alexander Dreymon', ' Eliza Butterworth', ' Arnas Fedaravicius', ' Mark Rowley']"
98,Delete,2023,Present,45,"['Drama', ' Horror', ' Romance']",6.3,786,"A complicated relationship with secrets to hide, and a grim question to ponder: who do you want to delete from your life?","['Natara Nopparatayapon', ' Nat Kitcharit', ' Sarika Sartsilpsupa', ' Chutimon Chuengcharoensukying']"
99,Riverdale,2017,2023,45,"['Crime', ' Drama', ' Mystery']",6.5,"149,847","While navigating the troubled waters of romance, school and family, Archie and his gang become entangled in dark Riverdale mysteries.","['Lili Reinhart', ' Camila Mendes', ' Cole Sprouse', ' K.J. Apa']"
100,Bridgerton,2020,Present,60,"['Drama', ' History', ' Romance']",7.4,"153,246",The eight close-knit siblings of the Bridgerton family look for love and happiness in London high society. Inspired by Julia Quinn's best selling novels.,"['Nicola Coughlan', ' Julie Andrews', ' Luke Newton', ' Luke Thompson']"
