listing_id,type,title,province,city,value_usd,value_idr,negotiable,live_id,building_size,land_size,certificate,bedroom,bathroom,carport,realtor,realtor_office,contact
373693,apartment,Apartemen di Bendungan Hilir,DKI Jakarta,Jakarta Pusat,166220,2504602960,False,L21141130,,,SHM/Freehold,2,,,Susilowati .,Ray White Senayan,6281310384009
373718,apartment,"Apartemen Bonavista, Dekat Pondok Indah Mall",DKI Jakarta,Jakarta Selatan,113030,1703136040,True,L21143281,120,,SHM/Freehold,4,3,,Joice Louhanapessy,Ray White Kebayoran Barito,6282258169521
373627,apartment,Apartment Mont Blanc Studio Full Furnished Jatimulya Bekasi Timur,Jawa Barat,Bekasi,31249,470859932,True,L21097677,26,26,SHM/Freehold,1,1,,Hartono -,Ray White Grand Wisata,62818593652
373587,apartment,2 BR Apartemen Trans Park Cibubur - Posisi Hoek dan View Bagus,DKI Jakarta,Jakarta Timur,73137,1102028316,True,L21127605,45,48,Akta Tanah,2,1,,Susie Boedja,Ray White Cibubur,6281316311390
373588,apartment,2 Bed Room Apartemen Trans Park Cibubur - Posisi Hoek dan View Bagus,DKI Jakarta,Jakarta Timur,106381,1602948908,True,L21127645,71,71,Akta Tanah,3,1,,Susie Boedja,Ray White Cibubur,6281316311390
373670,apartment,1 Unit Apartemen Full Furnish Siap Huni Di Mataram City Sleman,Yogyakarta,Sleman,39893,601107724,False,L21137395,34,,SHM/Freehold,1,1,,OFFICE RWNJ,Ray White Central Jogja,6282223817181
373589,apartment,"Apartemen di Metropolis, Type Studio, Kosongan, dkt Kampus - NH -",Jawa Timur,Surabaya,17287,260480516,True,L21134250,20,20,HGB,1,1,1,Neng Sumiati,Ray White Jemursari,6281703678965
373570,apartment,"Dijual unit 1Br apartment Vasanta, MM2100, Cibitung",Jawa Barat,Bekasi,26595,400733460,True,L21125511,35,35,Strata Title,1,1,,Joanna Santoso,Ray White Grand Wisata,6287888997979
373463,apartment,Apartemen Sudirman Mansion,DKI Jakarta,Jakarta Selatan,1462737,22040521116,False,L21097646,460,,SHM/Freehold,5,,,Susilowati .,Ray White Senayan,6281310384009
373569,apartment,"Apartemen Siap Huni & Nyaman @Apartemen Taman Sari Semanggi, Sudirman",DKI Jakarta,Jakarta Selatan,166220,2504602960,False,L21125502,72,,Strata Title,2,1,,Adi Kustriadi,Ray White Bintaro Trade Center,6281210104053
373420,apartment,Sudirman Residence 3BR Ground Floor Private Lift,DKI Jakarta,Jakarta Selatan,631636,9517491248,True,L21057170,236,,SHM/Freehold,3,2,1,Addnan Syarief,Ray White Brawijaya,6281314898110
373431,apartment,Apartemen Studio di Depok,Jawa Barat,Depok,28257,425776476,False,L21057384,22,,SHM/Freehold,1,1,,Lily Nathalia,Ray White Bintaro Jaya III,628128099222
373395,apartment,"Apartemen   Bintaro Icon Tower Chrysant Luas 21.84m2 Harga 350 Jt, MURAH!",Banten,Tangerang,23271,350647428,False,L21057178,21,,strata title,1,1,,Agus Christian,Ray White Priority Menteng Bintaro,6282129795005
373234,apartment,Apartment Sudirman Residence Ground Floor Private Lift,DKI Jakarta,Jakarta Selatan,565148,8515650064,True,L21028778,236,,SHM/Freehold,3,2,1,Stella Sari Dewy,Ray White Brawijaya,6281310331809
373247,apartment,Jual murah apartement U-Residence tower 2 type corner lippo karawaci tangerang,Banten,Tangerang,129652,1953596336,True,L21029376,,9691,SHM/Freehold,2,2,,Yanny Karawaci,Ray White Karawaci,6282112754898
373240,apartment,Apartemen Gading Mediterania Twr C Kelapa Gading Luas 43m2,DKI Jakarta,Jakarta Utara,31582,475877576,False,L21029109,43,,SHM/Freehold,2,1,,Briegita RWKG,Ray White Kelapa Gading,6287881648777
373196,apartment,"Apartemen Siap Huni, Nyaman, dan Strategis @Apartemen Breeze, Bintaro",DKI Jakarta,Jakarta Selatan,43882,661213976,False,L20994976,30,,Akta Tanah,,,,Merry Christina,Ray White Bintaro Trade Center,6287771888727
373189,apartment,"Apartemen Lokasi Strategis dan Hunian Nyaman @Apartemen Emerald, Bintaro",Banten,Tangerang,38231,576064708,False,L20994910,38,,Akta Tanah,2,1,,Istasadhya Ista,Ray White Bintaro Trade Center,628158991516
373198,apartment,Apartemen Siap Huni dan Fasilitas Lengkap @Apartemen Emerald,Banten,Tangerang Selatan,39560,596090080,False,L20994989,36,,Akta Tanah,2,1,,Hanifah Titisari,Ray White Bintaro Trade Center,628119990796
373201,apartment,"Apartemen Siap Huni, Hunian Asri, dan Nyaman @Apartemen Altiz, Bintaro Sektor 3",DKI Jakarta,Jakarta Selatan,41555,626150740,False,L20994995,26,,Strata Title,1,1,,Ervina Ida,Ray White Bintaro Trade Center,6281284932210
373197,apartment,Apartemen Siap Huni dan Fasilitas Lengkap @Apartemen Emerald,Banten,Tangerang Selatan,39560,596090080,False,L20994985,36,,Akta Tanah,2,1,,Ervina Ida,Ray White Bintaro Trade Center,6281284932210
373160,apartment,"Apartment Jarrdin Furnished di jalan Cihampelas, Bandung",Jawa Barat,Bandung,36568,551006624,True,L20994642,66,,Strata Title,3,2,,Gloria Danu,Ray White Prioritas Sutami,6285161012294
373068,apartment,Landmark Apartment 3BR Lantai 18 Beautifully Furnished Tower B,Jawa Barat,Bandung,172869,2604790092,True,L20993379,89,90,SHM/Freehold,3,3,,Chandra K,Ray White Sukajadi,6281321133728
372945,apartment,Apartemen Royale Springhill Kemayoran Tower Magnolia,DKI Jakarta,Jakarta Utara,119678,1803308104,True,L20985634,79,,SHM/Freehold,1,1,,Jun Martin Setiady,Ray White Senayan,6287877234878
372928,apartment,1 Unit Apartemen Full Furnish Dekat Atmaja Babarsari Sleman,Yogyakarta,Sleman,46209,696277212,False,L20982123,21,21,SHM/Freehold,1,1,,OFFICE RWNJ,Ray White Central Jogja,6282223817181
372958,apartment,"Apartemen Siap Huni dengan Fasilitas Lengkap @Apartemen Cosmo Terrace, Thamrin",DKI Jakarta,Jakarta Pusat,66488,1001841184,False,L20987709,40,,Hak Lainnya,1,1,,Merry Christina,Ray White Bintaro Trade Center,6287771888727
372900,apartment,"Orange County Apartment, Pasadena Tower With Garden View",Jawa Barat,Bekasi,49866,751380888,False,L20977929,42,42,Akta Tanah,1,1,,Wahyu Putra Pribadi,Ray White Cikarang,6281219135665
372901,apartment,"Pollux ChadStone Apartment, Dario Tower With City View",Jawa Barat,Bekasi,43217,651193756,False,L20977957,42,42,Akta Tanah,2,1,,Wahyu Putra Pribadi,Ray White Cikarang,6281219135665
372952,apartment,Apartment Penthouse Pantai Mutiara,DKI Jakarta,Jakarta Utara,1063809,16029474012,False,L20987496,571,,Strata Title,4,3,2,Yenny Jap,Ray White PIK,62818158166
372903,apartment,"Apartemen Grande Valore Condominium, Jababeka Cikarang Bekasi Luas 44,67m2",Jawa Barat,Bekasi,146274,2204056632,False,L20981093,44,,Strata Title,1,1,,Ellyta Admin,Ray White Kelapa Gading,6285792218888
372769,apartment,Leasehold brand new residence in area Tumbak Bayuh - E2,Bali,Badung,86434,1302387512,False,L20850024,46,552,Leasehold,2,2,,Eunike. Berlianne A.S,Ray White Canggu,6282145053818
372771,apartment,APARTEMEN DI LOKASI STRATEGIS DITENGAH KOTA JABABEKA CIKARANG,Jawa Barat,Bekasi,19946,300546328,False,L20963196,24,24,Strata Title,1,1,,Hendrikus Buto Ritan,Ray White Cikarang,6281319995975
